{
  "schema_version": "rtlflowbench.yosys_equivalence_contract.v1",
  "task_id": "G11-picorv32-qor",
  "top_module": "picorv32",
  "language": "verilog_2005",
  "source_paths": ["picorv32.v"],
  "parameters": {
    "ENABLE_COUNTERS": 1,
    "ENABLE_COUNTERS64": 1,
    "ENABLE_REGS_16_31": 1,
    "ENABLE_REGS_DUALPORT": 1,
    "LATCHED_MEM_RDATA": 0,
    "TWO_STAGE_SHIFT": 1,
    "BARREL_SHIFTER": 1,
    "TWO_CYCLE_COMPARE": 0,
    "TWO_CYCLE_ALU": 0,
    "COMPRESSED_ISA": 1,
    "CATCH_MISALIGN": 1,
    "CATCH_ILLINSN": 1,
    "ENABLE_PCPI": 1,
    "ENABLE_MUL": 1,
    "ENABLE_FAST_MUL": 0,
    "ENABLE_DIV": 0,
    "ENABLE_IRQ": 1,
    "ENABLE_IRQ_QREGS": 1,
    "ENABLE_IRQ_TIMER": 1,
    "ENABLE_TRACE": 0,
    "REGS_INIT_ZERO": 0,
    "MASKED_IRQ": "32'h00000000",
    "LATCHED_IRQ": "32'hffffffff",
    "PROGADDR_RESET": "32'h00000000",
    "PROGADDR_IRQ": "32'h00000010",
    "STACKADDR": "32'hffffffff"
  },
  "sequential_depth": 4,
  "max_source_bytes": 524288
}
